,year,month,day,level_3,Title,Date,Price
1016,2012,11,22,Title,South American weather cuts soya further Drier weather to assist Vietnam crop Mombasa port increases cargo tariffs Cut to Honduras coffee estimate Ecuador will lift cocoa production with new plants Ivorian sustainability vital to future of cocoa output Burundi’s coffee earnings dragged lower Robusta slide continues as demand weakens further ,11/22/12,1.4636
1017,2012,11,23,Title,ICE US Review: Coffee declines on ample supplies ,11/23/12,1.4698
1018,2012,11,24,Title,WCC2012: Confusion over new cocoa export tax ,11/24/12,1.4698
1019,2012,11,25,Title,EU approval for phosphane ,11/25/12,1.4698
1020,2012,11,26,Title,ICE US Review: Cocoa values retreat Colombian coffee production estimate lowered ,11/26/12,1.4462
1021,2012,11,27,Title,ICE US Review: Coffee mostly higher due to production problems San Pedro sees cocoa arrivals lag behind last year ,11/27/12,1.4307
1022,2012,11,28,Title,ICE US Review: Coffee up with oversold sentiment ,11/28/12,1.431
1023,2012,11,29,Title,CCC not consulted over new tax on Ivorian bean exports Rabobank tips ag commodity prices for decline in next year Coffee ticks up as crop now factored in ICE US Review: Coffee up with short covering Burundi boosts tea export revenues in October ,11/29/12,1.4733
1024,2012,11,30,Title,US FY 2013 Ag Export Forecast Raised to $145 Bil.; Trade Surplus at $30 Bil. ,11/30/12,1.4923
1025,2012,12,3,Title,ICE US Review: Coffee rebounds slightly higher Saputo acquires US$1.45bn Dean spin-off ICO pegs global coffee shipments higher in October Sumatra robusta shipments increase five-fold ,12/3/12,1.4563
1026,2012,12,4,Title,ICE US Review: Coffee down with large supply expectations Honduran coffee shipments leap last month Vietnamese coffee exports pegged in line with last year Soyabeans to drive US agricultural exports Canada's Saputo buys Morningstar Foods for $1.5 billion ,12/4/12,1.4395
1027,2012,12,5,Title,ICE US Review: Coffee boosted by bargain buying Colombian coffee shipments rise to highest in four years Tea Board of India criticised over quality issues ,12/5/12,1.4142
1028,2012,12,6,Title,"ICE canola surges on StatsCan revision Vietnam gains from dry weather US agricultural exports to reach new high in 2013 Honduras boosts coffee exports Tea Board slammed over quality issues Vietnam could ship 150,000 tonnes of coffee in December ICE US Review: Coffee lifted by short covering Deadly fungus unlikely to affect Mexican coffee crop Indonesian robusta premiums at seven-month high Coffee close to cost of production but may still have further to fall ",12/6/12,1.4185
1029,2012,12,7,Title,ICE US Review: Coffee up with slow farmer selling Brazilian green coffee exports pegged 5m bags lower Large purchases of Colombian coffee sends premiums higher ,12/7/12,1.4393
1030,2012,12,10,Title,ICE US Review: Coffee drops to 30-month lows Colombian coffee output almost 9% lower last month ,12/10/12,1.4529
1031,2012,12,11,Title,ICE US Review: Coffee corrects higher ICO expects rise in 2012/13 global coffee output ,12/11/12,1.4071
1032,2012,12,12,Title,ICE US Review: Cocoa back above chart resistance Chocolate coated tropical fruit snacks Kenyan port strike may hit East African coffee exports ,12/12/12,1.4264
1033,2012,12,13,Title,Slower US exports curtail maize pricing Indonesian cassia unmoved by rainy season in Sumatra Colombian coffee lower Seasonal fall for EU port stocks Fruit drying presents a lucrative option for Peruvian processors ICE US Review: Coffee hits fresh 30-month lows Ugandan coffee shipments seen 3% higher ,12/13/12,1.4026
1034,2012,12,14,Title,ICE US Review: Sugar closes above chart resistance ,12/14/12,1.3759
1035,2012,12,17,Title,ICE US Review: Sugar up with short covering Burundi enjoys increase in November coffee earnings El Salvador sees rise in November coffee exports ,12/17/12,1.3677
1036,2012,12,18,Title,ICE US Review: Coffee corrects lower Nicaragua sees huge leap in coffee exports Indian coffee prices rise at latest auction Vietnamese coffee down to 10-month low ,12/18/12,1.3921
1037,2012,12,19,Title,ICE US Review: Coffee up with slow farmer selling Ivory Coast sets new farmgate coffee price Cameroonian cocoa prices down by up to 10% ,12/19/12,1.3779
1038,2012,12,20,Title,Vietnamese coffee price slip ICE/NYSE Liffe merger may be back on ICE US Review: Coffee down with pre-holiday liquidation Louis Dreyfus takes bet on Colombian coffee Deal to join ag bourses together looks to be back on Burundi boosts tea export earnings on Kenyan woes ,12/20/12,1.3961
1039,2013,2,15,Title,ICE US Review: Coffee eases on popor demand Nestle expects harsh trading environment to continue ,2/15/13,1.3441
1040,2013,2,18,Title,Country Profile: Will Nicaragua need an agricultural revolution? Cameroonian cocoa prices fall amid poor quality ,2/18/13,1.3441
1041,2013,2,19,Title,ICE US Review: Coffee down with large supply expectations Cameroonian cocoa shipments seen higher Nicaraguan coffee shipments decline last month News Analysis: African cocoa farmers driven to other crops ,2/19/13,1.3373
1042,2013,2,20,Title,ICE US Review: Short covering lifts coffee Hopes raised for coffee crop in Vietnam ,2/20/13,1.319
1043,2013,2,21,Title,MEPs vote to curb Commission powers on breakfast laws ICE US Review: Coffee up with fungus concerns Weekly Market Review: Steady demand maintains strength in canola Brazil under threat of more port strikes ,2/21/13,1.3549
1044,2013,2,22,Title,ICE US Review: Coffee up with strong Latin American exports ,2/22/13,1.3538
1045,2013,2,25,Title,ICE US Review: Cocoa posts fractional gains Vietnamese coffee prices at four-and-a-half-month high ,2/25/13,1.3734
1046,2013,2,26,Title,ICE US Review: Cocoa eases on good supply base Vietnam tipped for fall in coffee exports ,2/26/13,1.3734
1047,2013,2,27,Title,ICE US Review: Coffee down with profit-taking Mexican coffee shipments slightly higher in January Burundi sees decline in tea export earnings on lower volumes Cocoa industry has concerns for future of Ivorian reforms Desperate Colombian coffee growers begin strike action ,2/27/13,1.3644
1048,2013,3,1,Title,ICE US Review: Coffee up with disease concerns Vietnamese robusta coffee prices climb to new multi-month highs Sumatra coffee exports increase four-fold ,3/1/13,1.3718
1049,2013,3,4,Title,ICE US Review: Coffee up with disease concerns ,3/4/13,1.3695
1050,2013,3,5,Title,ICE US Review: Coffee corrects lower with profit-taking Oxfam demand better social and environmental policy ,3/5/13,1.4061
1051,2013,3,6,Title,ICE US Review: Coffee holds steady Guatemalan coffee output could fall by 25% Country Profile: Global suppliers can bank on Switzerland ,3/6/13,1.349
1052,2013,3,7,Title,ICE US Review: Sugar jumps to one-month highs Low milk prices tip Germany's Schwälbchen into red Supply concerns propel Vietnam robusta prices upwards Weekly Market Review: Unsupported cocoa market falls further Brazil gets beneficial coffee rains but Minas Gerais needs more ,3/7/13,1.3549
1053,2013,3,8,Title,ICE US Review: Sugar consolidates ahead of weekend Smoothie distribution deal to US caterers Colombian coffee growers agree to end strike action Brazilian green coffee exports slightly down in February ,3/8/13,1.3681
1054,2013,3,11,Title,ICE US Review: Coffee eases in thin trade Vietnamese coffee prices increase by 3% ICE to introduce cap on soft commodity trading fees ,3/11/13,1.3733
1055,2013,3,12,Title,ICE US Review: Coffee down on large crop ideas Ugandan coffee shipments increase by a third ,3/12/13,1.3766
1056,2013,3,13,Title,ICE US Review: Coffee down on profit-taking El Salvador sees nearly 16% drop in coffee shipments ICO voices concern over low arabica prices ,3/13/13,1.3629
1057,2013,7,23,Title,ICE US Review: Large global sugar expectations weaken prices Central American coffee export down by nearly 13% ,7/23/13,1.2135
1058,2013,7,24,Title,"ICE US Review: Sugar lower on high cane-crushing numbers Frost concern for Brazil's southern coffee belt Editorial: Why weather is more than just a news filler The New York Times –– Starbucks, Danone join in effort to move more yogurt ",7/24/13,1.223
1059,2013,7,25,Title,ICE US Review: Short-covering moves sugar higher Weekly Market Review: Most commodities decline ,7/25/13,1.1862
1060,2013,7,26,Title,ICE US Review: Delayed Brazilian harvest strengthens sugar Higher Vietnamese coffee premiums triggers stock drawdown Ivorian cocoa buyers convicted of violating price rules ,7/26/13,1.2072
1061,2013,7,29,Title,ICE US Review: Sugar futures close at four-week highs Exports boost Nestlé India's sales ,7/29/13,1.192
1062,2013,7,30,Title,"ICE US Review: Cocoa recovers following sharp losses Vietnamese coffee farmers hold back stocks Heavy rainfall damages 124,600 bags of ICE coffee Louis Dreyfus unveils post-Schoen strategy ",7/30/13,1.1855
1063,2013,8,1,Title,ICE US Review: Coffee falls to four year lows European Coffee Federation urges Vietnam to address tax issue Weekly Market Review: Ideal weather weighs on grains and oilseeds Frost damages 18% of Brazil sugar cane crop ,8/1/13,1.1662
1064,2013,8,2,Title,ICE US Review: Coffee up ahead of Brazilian government speech Brazilian exports of soy and coffee decline in July Honduran coffee shipments tumble by two-thirds Kraft Foods Group reports higher income for second quarter Global coffee shipments decline by almost 10% ,8/2/13,1.1435
1065,2013,8,5,Title,"ICE US Review: Coffee up with short covering Nestlé to launch tea maker in Japan Media Watch: Aug. 5, 2013
 ",8/5/13,1.1669
1066,2013,8,6,Title,"Coffee companies worry FSMA preventive controls would ""dilute"" HACCP plans ICE US Review: Coffee down with profit-taking Vietnamese coffee premiums narrow over last week Kenyan coffee prices decline at latest auction Tata to focus on organic growth in India ",8/6/13,1.1835
1067,2013,8,7,Title,ICE US Review: Coffee up with Brazilian government news Brazil's coffee belt escapes frost threat ,8/7/13,1.1651
1068,2013,8,8,Title,Coffee companies worry FSMA preventive controls would “dilute” HACCP plans ICE US Review: Cocoa up with dry weather worries Weekly Market Review: Grains and oilseeds pushed down further Brazil to buy coffee stocks to help its struggling farmers Analysis: Coffee to spearhead Colombian recovery ,8/8/13,1.1923
1069,2013,8,9,Title,ICE US Review: Sugar up with slower Brazilian processing European coffee stocks increase slightly Brazil cancels two Bayer triazophos product registrations ,8/9/13,1.1994
1070,2013,8,12,Title,ICE US Review: Lower cane production strengthens sugar Burundi tea exports fall amid higher Kenyan output ,8/12/13,1.4865
1071,2013,8,13,Title,ICE US Review: Unfavourable weather strengthens sugar Peruvian coffee production will be slashed this year ,8/13/13,1.2254
1072,2013,8,14,Title,ICE US Review: Coffee up with unfavourable weather Vietnamese coffee prices rise to highest in three weeks ,8/14/13,1.1923
1073,2013,8,15,Title,ICE US Review: Weak Brazilian real weighs on coffee and sugar Weekly Market Review: Sugar up on Brazilian weather concerns ,8/15/13,1.2197
1074,2013,8,16,Title,ICE US Review: Unfavourable weather strengthens cocoa EU-Brazil trade shows signs of continuing growth ,8/16/13,1.2144
1075,2013,8,19,Title,ICE US Review: Crop concerns boost cocoa prices Ugandan coffee shipments increase by nearly a third The Wall Street Journal –– Venezuela's Farm Policies Blamed for Lower Production ,8/19/13,1.2026
1076,2013,8,20,Title,ICE US Review: Production concerns boost cocoa prices Nepal tea producers call for more subsidies Cameroonian cocoa grind fails to rise Vietnamese coffee prices seen lower GSP changes will affect juice and canned tuna tariffs ,8/20/13,1.4468
1077,2013,8,21,Title,ICE US Review: Favourable weather undermines cocoa Smucker raises profit forecast on lower input costs Analysis: Belgium seeks to keep trade balance positive Coffee rust still threatening crops in Central America Kenyan tea price continues to rise despite Egypt riots ,8/21/13,1.1488
1078,2013,8,22,Title,ICE US Review: Cocoa finishes flat due to lack of fresh news Peruvian coffee farmers clash with police Brazilian frost won't have huge impact on coffee crop Weekly Market Review: Soybeans move up on US weather concerns Stockton debuts Timorex Gold in Central America EU revised trade preferences to apply from January 2014 ,8/22/13,1.1357
1079,2013,8,23,Title,ICE US Review: Rainfall concerns boost sugar Vietnamese coffee prices decline to eight-week low CME launches bid to buy Paris grains contracts ,8/23/13,1.1276
1080,2013,8,26,Title,"ICE US Review: Unfavourable weather boosts cocoa Media Watch: Aug. 26, 2013
 ",8/26/13,1.1426
1081,2013,8,27,Title,ICE US Review: Favourable weather weakens cocoa Vietnam coffee prices tumble as buyers sidelined ,8/27/13,1.1374
1082,2013,8,28,Title,ICE US Review: West African weather uncertainty supports cocoa Disease set to have massive impact on Costa Rica coffee ,8/28/13,1.1227
1083,2013,8,29,Title,ICE US Review: Cocoa down after hitting chart resistance Weekly Market Review: Soybean prices rise further Starbucks to open its first cafe in Colombia next year ,8/29/13,1.1401
1084,2013,8,30,Title,"ICE US Review: Cocoa, coffee, sugar down ahead of long weekend Brazil’s booming farms reap benefit of weak currency Brazil’s booming farms reap benefit of weak currency ",8/30/13,1.1263
1085,2013,9,2,Title,Robusta exports from Sumatra up by more than a third ,9/2/13,1.1263
1086,2013,9,3,Title,ICE US Review: Speculative short covering lifts coffee Strong Vietnamese coffee supply to weigh on prices Costa Rican coffee shipments decline by more than a fifth Olam's profit dented by higher tax charges ,9/3/13,1.1144
1087,2013,9,4,Title,ICE US Review: Coffee down with large supply expectations Cameroon's cocoa sector moves to conform to EU rules Guatemalan coffee shipments decline in August Nepal could add tea to products under US GSP Half of inspected Brazil crop shows completely clean agchem use ,9/4/13,1.1251
1088,2013,9,5,Title,ICE US Review: Cocoa up with production worries in West Africa Weekly Market Review: Soybeans reverse price gains ,9/5/13,1.1211
1089,2013,11,6,Title,ICE US Review: Coffee hits seven year lows Ivory Coast sentences 15 'cocoa barons' for embezzlement ,11/6/13,1.0115
1090,2013,11,7,Title,ICE US Review: Sugar down near 6-week lows amid harvest Weekly Market Review: Canola futures lower slightly ahead of USDA report FDA Takes First Steps to Drop Trans Fat from 'Generally Recognized as Safe' List of Foods ,11/7/13,0.9971
1091,2013,11,8,Title,ICE US Review: Coffee closes higher amid crop damage concerns ,11/8/13,1.0141
1092,2013,11,11,Title,ICE US Review: Coffee down with large global supplies ,11/11/13,1.0216
1093,2013,11,12,Title,ICE US Review: Sugar closes lower amid harvest pressure Vietnamese coffee prices at lowest since 2010 Armajaro to sell commodity trading business to Ecom Noble's profits brought down by associates ,11/12/13,1.0176
1094,2013,11,13,Title,ICE US Review: Strong Brazilian crush data weakens sugar Starbucks to pay damages to Kraft over coffee supply deal Rains could disrupt Vietnam coffee harvest ,11/13/13,1.0334
1095,2013,11,14,Title,"New study finds caffeine intake comes from coffee, soda, not energy drinks ICE US Review: Coffee down with large global supplies Weekly Market Review: Soy prices rise after WASDE ",11/14/13,1.0085
1096,2013,11,15,Title,ICE US Review: Sugar down amid an expected global surplus Burundi sees income from coffee rise by two-thirds ,11/15/13,1.0046
1097,2013,11,18,Title,ICE US Review: Corrective bounce boosts sugar prices ,11/18/13,1.0329
1098,2013,11,19,Title,ICE US Review: Cocoa up amid higher butter prices Vietnam announces it will buy a fifth of the coffee crop Coffee exporters in Vietnam reduce asking prices Tata benefits from weak rupee ,11/19/13,1.0382
1099,2013,11,20,Title,ICE US Review: Unfavourable weather strengths cocoa Cameroon ships less robusta year-on-year ,11/20/13,1.0424
1100,2013,11,21,Title,ICE US Review: Profit taking weakens cocoa Weekly Market Review: Cocoa futures strengthen ,11/21/13,1.0449
1101,2013,11,22,Title,ICE US Review: Cocoa closes the week higher Brazilian government to support coffee growers ,11/22/13,1.0535
1102,2013,11,25,Title,ICE US Review: Sugar falls to more than two month low ,11/25/13,1.0222
1103,2013,11,26,Title,ICE US Review: Cocoa down with profit taking Vietnamese coffee differentials narrow ,11/26/13,1.0248
1104,2013,11,27,Title,ICE US Review: Coffee weaker with large global supplies Colombia to keep supporting coffee growers ,11/27/13,1.0321
1105,2013,11,28,Title,Weekly Market Review: Soybeans gather pace on bullish soymeal market Widespread across Brazil coffee areas World coffee output to decrease ,11/28/13,1.0321
1106,2013,11,29,Title,ICE US Review: Cocoa closes the week higher ,11/29/13,1.0227
1107,2013,12,2,Title,ICE US Review: Cocoa hits 2-year highs Indonesian coffee exports up 73% ,12/2/13,1.061
1108,2013,12,3,Title,ICE US Review: Cocoa consolidates near highs Vietnam coffee loading to jump as harvest picks up ,12/3/13,1.0464
1109,2013,12,4,Title,ICE US Review: Cocoa corrects lower C.American coffee output cut by only 9.7% ,12/4/13,1.0497
1110,2013,12,5,Title,ICE US Review: Sugar holds steady Editorial: Vietnam's low coffee gains AICC 2013: Robusta price rebound could continue into 2014 Weekly Market Review: Canola slides on Canadian crop Interview: “I like to be in the middle of the pepper business.” AICC 2013: Vietnamese coffee delegates call for increased value addition ,12/5/13,1.0358
1111,2013,12,6,Title,ICE US Review: Sugar continues downtrend ,12/6/13,1.0126
1112,2013,12,9,Title,ICE US Review: Profit taking weakens cocoa ,12/9/13,1.0157
1113,2013,12,10,Title,ICE US Review: Sugar strengthens amid weak crush numbers Kenyan coffee slides at auction ,12/10/13,1.012
1114,2013,12,11,Title,ICE US Review: Cocoa moves lower amid good harvest conditions Mixed weather for global coffee harvests ,12/11/13,1.0533
1115,2013,12,12,Title,ICE US Review: Coffee strengthens amid a lack of selling World coffee outlook: bullish over the long term Weekly Market Review: Canola futures continue downward spiral Tanzanian coffee prices decline on oversupply fears ,12/12/13,1.0505
1116,2013,12,13,Title,"ICE US Review: Coffee closes stronger amid short covering Rabobank says cocoa price to rise, coffee to fall in 2014 Nestlé to distribute 12 million cocoa seedlings in Ivory Coast Narrowing Indonesian robusta premium spurs some trade ",12/13/13,1.0603
1117,2013,12,16,Title,ICE US Review: Coffee closes mixed Vietnamese coffee exports decline by a third ,12/16/13,1.093
1118,2013,12,17,Title,ICE US Review: Cocoa closes the session weaker Ugandan coffee shipments higher last month ,12/17/13,1.0984
1119,2013,12,18,Title,ICE US Review: Cocoa finishes close to unchanged Tesco plans entry into Indian retail sector El Salvador sees drastic fall in coffee exports ,12/18/13,1.0843
1120,2013,12,19,Title,"ICE US Review: Profit taking weakens coffee Weekly Market Review: Coffee futures rise on arabica demand boost Editorial: Review of 2013, outlook for the coming year Vietnamese coffee trades at a discount to London futures India eyeing young tea consumers amid plentiful production in 2013 ",12/19/13,1.0999
1121,2013,12,20,Title,ICE US Review: Short covering strengthens coffee Ivory Coast leaves fixed coffee price for farmers unchanged Cameroon's robusta exports fall drastically Cameroonian cocoa exports lower than last season Brazil raises view for 2013 coffee production ,12/20/13,1.0961
1122,2013,12,23,Title,ICE US Review: Short covering strengthens coffee Peruvian coffee output may decline by nearly a fifth Vietnam expected to ship 50% less coffee in December Tesco enters India in Tata stores alliance ,12/23/13,1.0961
1123,2013,12,24,Title,ICE US Review: Quiet trading ahead of Christmas ,12/24/13,1.0961
1124,2013,12,27,Title,"ICE US Review: Coffee closes higher amid lack of selling ICE trims margins for corn, wheat, soybeans & sugar ICE trims margins for corn, wheat, soybeans & sugar ",12/27/13,1.0961
1125,2013,12,30,Title,ICE US Review: Cocoa finishes weaker amid profit taking ,12/30/13,1.0961
1126,2014,1,2,Title,ICE US Review: Fresh near-term supplies weaken cocoa Robusta shipments from Sumatra up by more than 17% Weekly Market Review: Corn futures near 40% annual slide ,1/2/14,1.0764
1127,2014,1,3,Title,ICE US Review: Short covering boosts coffee Honduras sees small advance in December coffee shipments Indian coffee production could decline by 10% Brazil sugar exports rise in December ,1/3/14,1.0764
1128,2014,1,6,Title,"ICE US Review: Coffee closes stronger amid short covering Ivorian cocoa stocks at 107,217 tonnes by end of 2012/13 ",1/6/14,1.1211
1129,2014,6,12,Title,ICE US Review: Cocoa backs away from 3-year highs WCC 2014: Cocoa producers focus on domestic consumption WCC 2014: Lower taxes and greater price transparency beneficial to cocoa farmers WCC 2014: Ivory Coast grinding capacity growth may be limited ,6/12/14,1.6688
1130,2014,6,13,Title,Dutch Starbucks tax regime probed as illegal state aid ,6/13/14,1.6728
1131,2014,6,16,Title,ICE US Review: Coffee futures higher in consolidation trading ,6/16/14,1.6796
1132,2014,6,17,Title,ICE US Review: Coffee sharply lower with spec selling Vietnamese coffee price narrows against London ICE US Review: Coffee down as Brazilian harvest progresses ,6/17/14,1.6693
1133,2014,6,18,Title,Vietnam coffee exports slip in May ,6/18/14,1.6291
1134,2014,6,19,Title,"ICE US Review: Coffee mixed, consolidating after recent losses Cameroonian cocoa grinders buy slightly more Weekly Review: Soy and corn trickle down as USDA report looms   ICE US Review: Coffee down with follow-through selling ",6/19/14,1.6229
1135,2014,6,20,Title,Latin American coffee shipments rise Hawaiian coffee and macadamia growers receive funding to combat pests Macadamia growers receive funding to combat pests ,6/20/14,1.6116
1136,2014,6,22,Title,ICE US Review: Coffee up sharply with worries about tight supplies ,6/22/14,1.6116
1137,2014,6,23,Title,ICE US Review: Coffee pushes upwards with harvest concerns ,6/23/14,1.6682
1138,2014,6,24,Title,ICE US Review: Cocoa ends lower with increased production Nestlé to source more commodities directly from farmers Mexican coffee exports down 20% ,6/24/14,1.6758
1139,2014,6,25,Title,EU overtakes US as world's leading agri-food exporter Analysis: EU member states roll-out the red carpet for Chinese premier   USDA: Food Price Inflation in 2014 to Return to Range Closer to Historical Norm ,6/25/14,1.6589
1140,2014,6,26,Title,EU overtakes US as world's leading agri-food exporter Weekly Review: Canola futures correlate higher with soy Editorial: Summer slump or football fever?  ICE US Review: Coffee surges with apparent crop damage ,6/26/14,1.7207
1141,2014,6,27,Title,Feed News Brazil coffee harvest reaches 35-40%  Vietnam coffee exports jump in June ICE US Review: Sugar mixed on drought concerns ,6/27/14,1.7092
1142,2014,6,29,Title,ICE US Review: Cocoa rallies on demand worries ,6/29/14,1.7092
1143,2014,6,30,Title,ICE US Review: Coffee corrections higher Robusta coffee beans gain greater world market share ,6/30/14,1.6562
1144,2014,7,1,Title,Vietnamese coffee trading slows over last week Sumatran coffee shipments down by 41% Frost in southern Brazil poses risk to grain crops ,7/1/14,1.6495
1145,2014,7,2,Title,ICE US Review: Coffee corrects higher ICE US Review: Cocoa corrects lower ,7/2/14,1.6251
1146,2014,7,3,Title,Country Profile: Peru on the cusp of agriculture export leadership? Weekly Review: USDA sends corn and soy futures plummeting ,7/3/14,1.6345
1147,2014,7,4,Title,Peruvian coffee premium at highest in three years European coffee stocks up by nearly 12% ICE US Review: Coffee closes near support levels ,7/4/14,1.6345
1148,2014,7,7,Title,Burundi tea exports down in Q1 China FTA opens up Swiss dairy opportunities Switzerland-China free trade deal enters into force ,7/7/14,1.6269
1149,2014,7,8,Title,ICE US Review: Coffee down in quiet trade ,7/8/14,1.6213
1150,2014,8,8,Title,Brazil to capitalise on Russian food ban Brazil OKs imports of cyantraniliprole ICE US Review: Coffee tanks on market correction ,8/8/14,1.7823
1151,2014,8,11,Title,Brazil coffee crop 86% harvested Nestlé confirms full-year outlook despite profit drop ICE US Review: Coffee finishes lower amid overbought supplies ,8/11/14,1.7575
1152,2014,8,12,Title,Top Brazil coffee region confirms huge losses  Hawaiian farmers assess losses from Iselle ICE US Review: Coffee shoots upward on production fears ,8/12/14,1.8335
1153,2014,8,13,Title,ICE US Review: Coffee corrects downward ,8/13/14,1.7913
1154,2014,8,14,Title,Weekly Review: Corn and soy markets bear brunt of mega crops ICE US Review: Coffee creeps upward ,8/14/14,1.8087
1155,2014,8,15,Title,"El Salvador sees coffee shipments plunge  Cameroonian cocoa prices higher this month Finnish farmers consolidate, as Russian sanctions start to bite ICE US Review: Coffee drifts lower ",8/15/14,1.7812
1156,2014,8,18,Title,ICE US Review: Coffee propelled upwards on bullish pattern ,8/18/14,1.8446
1157,2014,8,19,Title,Wall Street Journal –– US Consumers Turning Away from Orange Juice ICE US Review: Cocoa hits three-year high  ,8/19/14,1.8489
1158,2014,8,20,Title,Vietnam coffee values track global market lower Kenyan coffee prices decline  ICE US Review: Coffee falls due to large production numbers ,8/20/14,1.7859
1159,2014,8,21,Title,Market Report: Cocoa still rallying higher Weekly Review: Canola dips lower on abundant oilseed supplies ICE US Review: Sugar rises with short-covering ,8/21/14,1.8025
