,year,month,day,level_3,Title,Date,Price
283,2008,3,11,Title,Indonesian coffee farmers harvest early due to high prices Russia sets new Indian coffee import rules ,3/11/08,1.4153
284,2008,3,12,Title,"Milk product prices, March 12 Sasini of Kenya eyes tea warehousing and coffee lounges ICO revises world coffee production forecast for 2007/08 ",3/12/08,1.4265
285,2008,3,13,Title,"""False"" Priori Xtra seized in Brazil: Coffee supplies will be curbed by lower planting says ICO chief ",3/13/08,1.4471
286,2008,3,14,Title,"Kraft unveils coffee factory in Russian city of St Petersburg Exporters fret over quality as Ivorian strike enters a fifth day India looks to improve quality of tea, coffee and spices ",3/14/08,1.4877
287,2008,3,16,Title,Vietnam coffee rise Weather Cbot soyabeans down as oils complex plunges People and places Weak US dollar discourages extra coffee planting Strikes once again disrupt Ivorian cocoa sales Roaster claims coffee futures are 20% inflated Asian origins hurriedly sell coffee Dealing in a market that is out of control ,3/16/08,1.4877
288,2008,3,18,Title,Coffee slumps by greatest daily amount since middle of 2000 Ivorian beans flow again as dock workers talk with authorities ,3/18/08,1.3035
289,2008,3,19,Title,"Campina speaks of 'staggering' Russian growth New flavours for J.P. Licks March celebrations Milk product prices, March 19 Robusta coffee prices regain ground after overblown sell-off Nestlé plans milk powder price hikes Campina speaks of 'staggering' Russian growth US records rise in coffee imports and ending stocks Brazilian coffee producers boost sales from 2007/08 crop ",3/19/08,1.2962
290,2008,3,20,Title,Colombia keeps up trend of higher coffee production ,3/20/08,1.2698
291,2008,3,23,Title,Kraft opens in Russia Kenyan millers protest flood of cheap imports Hungary's industry faces bleak future Brazilian mills likely to boost sugar volumes Fast Brazilian sales US trade in coffee Ugandan coffee sales Indian quality push Commodity price crash highlights exposure to economic uncertainty Lack of labour compounds lower Indian output Mercon expects higher Brazilian production Rainfall and sun assist mid-crop in Ivory Coast Global jitters see sugar post two-month low ,3/23/08,1.2698
292,2008,3,25,Title,South Korea to lift import duties on key grains and raw materials ,3/25/08,1.2266
293,2008,3,26,Title,"Nestlé plans milk powder price hikes Milk product prices, March 26 Vietnam predicts lower robusta exports as sales slow ICO chief predicts rise in coffee demand from East Europe ",3/26/08,1.2503
294,2008,3,27,Title,Indian coffee zones hit by heavy rains just as blossoms appear Vietnam outlines plans for sustainable coffee industry ,3/27/08,1.2608
295,2008,3,28,Title,Fortis ups coffee output and consumption estimates for 2007/08 Colombian coffee shipments halted after cocaine discovery Eastern Cameroon sees large expansion in cocoa planting ,3/28/08,1.2527
296,2008,3,30,Title,Weather Canola bounces back as farmers hold firm Coffee output climb High coffee forecast Higher coffee sales will emerge in Eastern Europe Rain hits Indian coffee crop as bloom appears Vietnam works toward sustainable coffee sector Liffe changes may come with short-term pain ,3/30/08,1.2527
297,2008,4,1,Title,Indian arabica exports rise in first quarter but robusta down ,4/1/08,1.2188
298,2008,4,2,Title,"Milk product prices, April 2 India expects to get GI status for Monsooned Malabar coffee ",4/2/08,1.2327
299,2008,4,3,Title,EU sets MRL rules for fumigants ,4/3/08,1.2376
300,2008,4,4,Title,Vietnamese coffee growers rush to expand acreage ,4/4/08,1.2535
301,2008,4,6,Title,"Indian coffee exports Brazil dislikes coffee discrepancy Global coffee surplus will be larger, says Fortis Cocoa growing spreads to east of Cameroon Corn tests all-time high due to low US acreage Instant coffee move Coffee suspension ",4/6/08,1.2535
302,2008,4,7,Title,Indonesian port strike would curb exports of palm oil/coffee Indonesia should see growth in coffee exports this year ,4/7/08,1.2611
303,2008,4,8,Title,Imperial Sugar enters agreement with Maximus Coffee Group National Foods misses 2007 profit forecast Rabobank predicts rise in Brazilian robusta output this year Nestle's Thai unit wants to import coffee beans to cover shortfall ,4/8/08,1.2752
304,2008,4,9,Title,"National Foods misses 2007 profit forecast Milk product prices, April 9 Coke's luxury juice brand in coffee shop chain Indonesian ports operating as normal but strike action looms ",4/9/08,1.2746
305,2008,4,10,Title,"Friesland, Campina boards agree merger terms Rioters sever rail link Uganda uses to export coffee/cocoa El Salvador coffee exports decline in March Ncdex lowers tick size of its robusta coffee futures contracts ",4/10/08,1.2976
306,2008,4,11,Title,Mexican coffee exports in March slip from last year Nestlé linked to interest in Russia's WBD ,4/11/08,1.2832
307,2008,4,13,Title,Uganda says railway attack won't hit coffee sales UK honey sector sees ongoing demand growth Vietnam sets fast planting pace New exchange officially launched in Ethiopia Trading briefs People and places Indonesia sells more coffee on high crop hope Brazilian robusta leap Imperial/Maximus deal Weather Nestle coffee shortage Crude oil rises put energy into sugar market ,4/13/08,1.2832
308,2008,4,14,Title,Global coffee demand will rise this year says ICO report ,4/14/08,1.263
309,2008,4,15,Title,Cameroon cocoa exports rise from previous season Heavy rains likely to reduce Indonesian coffee crop ,4/15/08,1.2625
310,2008,4,16,Title,"Friesland, Campina boards agree merger terms Nestlé linked to interest in Wimm-Bill-Dann Milk product prices, April 16 ",4/16/08,1.2886
311,2008,4,17,Title,Odwalla in coffee shops Ivory Coast to boost robusta output in coming years ,4/17/08,1.2965
312,2008,4,20,Title,Mexican coffee slip Fund rolling adds to weakness of ICE coffee Ivorian agency hikes indicative farmgate price Cameroon enjoys cocoa bonanza Future development on the back burner Heavy rain falls in key Indonesian growing area Robusta price firm in face of large Brazilian crop ,4/20/08,1.2965
313,2008,4,21,Title,Nicaragua sees an increase in coffee exports Nestle's sales grow as it shows its power to absorb higher costs ,4/21/08,1.2993
314,2008,4,22,Title,Kenyan direct coffee sales set to double this year New plant boosts Panama's gourmet coffee sector Diedrich Coffee reports third quarter loss ,4/22/08,1.2709
315,2008,4,23,Title,"Soybeans dominate Brazilian agrochemical market Milk product prices, April 23 Brazil may subsidise arabica growers at auction this year ",4/23/08,1.289
316,2008,4,24,Title,Coffee roasters have raised prices by up to 15% in past year Lakeland's Hanley warns of  weaker markets ahead ,4/24/08,1.2942
317,2008,4,25,Title,Soft drinks manufacturer's shares buy-back London robusta looks set for serious drop says analyst ,4/25/08,1.2659
318,2008,6,8,Title,Robusta export delay ,6/8/08,1.2659
319,2008,6,11,Title,"Milk product prices, June 11 ",6/11/08,1.3016
320,2008,6,13,Title,Ivorian cocoa officials charged with fraud and embezzlement India expects coffee crop to increase next year ,6/13/08,1.292
321,2008,6,15,Title,Mexico sees coffee fall Strong coffee exports Heavy rains give Cbot soyabean values new life Officials in Daklak expect climb in coffee crop Brazil worries about lowest ever coffee stocks ,6/15/08,1.292
322,2008,6,16,Title,Cameroon cocoa exports decline due to heavy rain Ivory Coast cocoa officials charged with fraud (update) Machinery upgrades set to lift Burundi's tea export earnings ,6/16/08,1.2892
323,2008,6,17,Title,Nestle suspends output at Chinese coffee plant ,6/17/08,1.3146
324,2008,6,18,Title,"Arsenal in deal to promote Vinamilk's coffee brand Milk product prices, June 18 Colombian coffee exports increase in May ",6/18/08,1.3288
325,2008,6,22,Title,Midwest flood crisis causes new corn record Weather people and places Nestle shutters plant Pessimistic view of Ivorian crop fans flames in the cocoa market Cameroon on track to beat earlier exports Beans begin to flow in Vietnam Steady march upwards for Uganda's coffee sales Recovery from poor season helps India export ,6/22/08,1.3288
326,2008,6,23,Title,Ivory Coast cocoa arrests yet to impact exports say traders ,6/23/08,1.3644
327,2008,6,24,Title,Vietnam robusta price up on thinning stocks say traders Dry weather threatens Brazil robusta crop say analysts Cameroon farmers see record cocoa prices ,6/24/08,1.3708
328,2008,6,25,Title,"Coke launches Australian dairy drinks range Milk product prices, June 25 ",6/25/08,1.3905
329,2008,6,26,Title,Vietnam forecasts decline in coffee exports Ivorian cocoa body appoints new management after arrests ,6/26/08,1.4126
330,2008,6,29,Title,Fresh highs for cocoa as crop worries linger Charts Vietnam coffee fall Parched Espirito Santo will offer up less robusta Depleted stocks fuel Vietnam's bean quotations Cocoa returns reach new high in Cameroon ,6/29/08,1.4126
331,2008,7,1,Title,Indian coffee exports see slight rise in first half of year Vietnam's June coffee exports to fall says government ,7/1/08,1.4542
332,2008,7,2,Title,"YOGO opens first store in Surrey Milk product prices, July 2 Honduras sees growth in June coffee exports NYSE Euronext takes maximum possible stake in MCX ",7/2/08,1.4658
333,2008,7,3,Title,Fertiliser costs could limit Brazil's 2010/11 coffee output Costa Rican coffee exports in June up from last year ,7/3/08,1.4675
334,2008,7,4,Title,Coffee prices surge upwards at late season auctions in India ,7/4/08,1.4675
335,2008,7,6,Title,Honduran coffee sales EUlikes Indian coffee Corn and soya both manage rises after report Plan for West African bourse gains traction Weather Dehong aims for listing Costa Rican coffee Coffee fertiliser costs worry Brazil Fortis less upbeat for this year's coffee output Vietnam sees export lull despite good stocks ,7/6/08,1.4675
336,2008,7,7,Title,Coke to invest additional US$250 million in India ,7/7/08,1.4485
337,2008,7,8,Title,Vietnam coffee sales freeze as local prices follow downtrend ,7/8/08,1.375
338,2008,7,9,Title,"Major UK campaign to raise Gold Top's profile Milk product prices, July 9 Kenya pays $3.8m owed to coffee farmers ",7/9/08,1.3488
339,2008,7,10,Title,Coke's Indian investment ICO raises estimate of 2008/09 global coffee output Mexico sees decline in June coffee exports ,7/10/08,1.3371
340,2008,7,13,Title,Coffee shipments fall Higher coffee figures Charts Better weather in Brazil weakens coffee values Vietnam progresses after WTO accession Kenya releases money owed to coffee farmers Local price falls put freeze on Vietnam sales ,7/13/08,1.3371
341,2008,7,14,Title,Starbucks ventures into smoothies ,7/14/08,1.359
342,2008,7,15,Title,Kenyan coffee output to jump this season says trade report Brazil doubled roast and ground coffee exports says official ,7/15/08,1.3586
343,2008,7,16,Title,"Import duties fall on EU goods Cameroon cocoa exports continue to rise say officials Milk product prices, July 16 FO Licht predicts large global 2008/09 coffee harvest ",7/16/08,1.3461
344,2008,7,17,Title,What happens if the bubble in cocoa pops? Farmers flock back to Kenyan coffee sector Brazil finds new niche in value added products Canola values follow slumps in soya complex weather CHARTS Zimbabwe's macadamia nut industry slides into collapse Ugandan coffee outlook viewed as bleak Cameroon records increase in cocoa exports ,7/17/08,1.3454
345,2008,7,21,Title,Indonesia will look to Vietnam for coffee imports says official Colombian coffee exports and output dip in June ,7/21/08,1.3131
346,2008,7,22,Title,India could see coffee output fall next season says official ,7/22/08,1.3102
347,2008,7,23,Title,"UK Fairtrade pioneer moves into fruit juices and purees Milk product prices, July 23 ",7/23/08,1.3115
348,2008,7,24,Title,Ivory Coast to spray cocoa trees to increase output ,7/24/08,1.2944
349,2008,7,25,Title,Burundi sees substantial rise in tea export earnings ,7/25/08,1.2915
350,2008,7,27,Title,People and places Brazil's crop prevents arabica rise Dryness puts Indian coffee exports in jeopardy Indonesia resorts to buying beans from rival ,7/27/08,1.2915
351,2008,8,17,Title,Mexican coffee dive Amazingly high fertiliser costs harm coffee hopes Encouraging signs for Indian futures sector Weather ,8/17/08,1.2915
352,2008,8,18,Title,Red Bull associated with risk of heart disease Agreement reached to end Colombian truck strike ,8/18/08,1.2869
353,2008,8,19,Title,Retail contract loss forces switch to powder production Ivorian cocoa merchants fear main crop export disruption ,8/19/08,1.2951
354,2008,8,20,Title,"Retail contract loss forces Skånemejerier switch to powder Milk product prices, 20 August Central and South American coffee exports increase in July India to launch coffee replanting programme ",8/20/08,1.3044
355,2008,8,21,Title,Cameroon produced record cocoa crop last season ,8/21/08,1.3216
356,2008,8,22,Title,Ivorian cocoa prices rise as new crop beans appear Mexico expects new season coffee exports to increase ,8/22/08,1.345
357,2008,8,24,Title,General fall takes steam out of sugar market Charts Grinding out the maximum profitability More coffee exported False start to Brazilian coffee crop Colombian truckers agree to end strike action Officials deny main crop damage India to invest in crop replanting scheme ,8/24/08,1.345
358,2008,8,26,Title,Vietnam expects August coffee exports to rise by a third ,8/26/08,1.3365
359,2008,8,27,Title,"Milk product prices, August 27 Indonesia sees higher coffee arrivals ahead of Ramadan ",8/27/08,1.3617
360,2008,8,28,Title,Peru expects to increase coffee export revenue this year ,8/28/08,1.3909
361,2008,8,29,Title,Gustav threatens to batter crops in Jamaica and US ASEAN grouping and India reach free trade agreement ,8/29/08,1.3844
362,2008,8,31,Title,Ramadan encourages Indonesian coffee sales Nigerian cocoa exports leap in second quarter Vietnam predicts August exports up by a third Coffee exports boost TataTea unit looks at openings in Ethiopia People and places Decent supply adds to canola's weaker tone Weather Indian coffee fall Peru exploits high coffee prices with record crop ,8/31/08,1.3844
363,2008,9,1,Title,Bottled water and fruit drinks grow strongly in India Indian coffee exports rise in January to August period ,9/1/08,1.3844
364,2008,9,2,Title,India signs International Coffee Agreement as deadline passes Coffee shipments from Central America fell in August ,9/2/08,1.3726
365,2008,9,3,Title,"Milk product prices, September 3 Colombia aims to boost coffee output by a third Rise in local demand maintains Ethiopia's need to import sugar ",9/3/08,1.3579
366,2008,9,4,Title,Water and fruit drinks drive growth in Indian beverages ,9/4/08,1.3608
367,2008,9,5,Title,Brazil to subsidise arabica producers this season Indonesian coffee exports double in first seven months of year ,9/5/08,1.3751
368,2008,9,7,Title,Trade admits to cocoa disease loss Sumatra plunders its coffee carryover stocks Coffee revenue boost Trading briefs Rain in corn belt adds to commodity weakness Weak August upsets Central America's pace Six sign in last minute ICA flurry ,9/7/08,1.3751
369,2008,9,8,Title,Brazil's southeast coffee crop seen 10% to 15% lower New crop Vietnamese coffee trades in European market NMCE ready to relaunch coffee futures to market tomorrow World Bank urges Ivory Coast to totally overhaul cocoa sector ,9/8/08,1.3619
370,2008,9,9,Title,Vietnam aims to boost domestic coffee consumption ,9/9/08,1.3524
371,2008,9,10,Title,"Nestle plans to help Philippines reach coffee self sufficiency Milk product prices, September 10 India's plantation sector urges relief from Minimum Wages Act Ivorian strike starts to intensfiy and could upset cocoa exports ",9/10/08,1.3275
372,2008,9,11,Title,Hurricane Ike damages Cuban sugarcane crop ,9/11/08,1.3235
373,2008,9,12,Title,"ICO raises estimate for 2008/09 world coffee production Vietnam's Agribank gives coffee sector major support Japan's commodity futures regulator wants TGE merger Ivorian strike continues into eighth day, slowing cocoa exports Cuba scrambles to save coffee crop ravaged by Hurricane Ike ",9/12/08,1.3029
374,2008,9,14,Title,Nestle expands in Philippines Ike hits Cuban coffee Economic fears compound weak soya situation Charts Weather Worsening Ivorian pay strike risks exports Ghana price targets smugglers Brazil reveals support scheme for arabica price Early Vietnamese bean prices highly attractive ,9/14/08,1.3029
375,2008,9,15,Title,Taiwan bans imports as Chinese baby milk scare worsens Houston coffee warehouses unscathed by Hurricane Ike Olam diversifies into sugar and wheat sectors in Nigeria ,9/15/08,1.3082
376,2008,9,16,Title,Unilever to make Starbucks ice cream Lehman tries to pass on US derivatives unit but suspended in Europe ,9/16/08,1.3001
377,2008,9,17,Title,"Kraft to focus on ten countries, ten brands Unilever to develop Starbucks ice cream Vietnamese bank injects credit into coffee sector Milk product prices, September 17 ICO raises 2008/09 global coffee production forecast Colombian coffee output and exports decline in August ",9/17/08,1.2641
378,2008,9,19,Title,Vietnam expects to boost cocoa production and export ,9/19/08,1.2431
379,2008,9,21,Title,Global financial upheaval batters commodities as speculators flee Ivory Coast will opt for single cocoa regulator ICO hikes its view of global coffee production Vietnam's coffee sector gets much needed credit People and places Canola drops but may spur better demand Japanese association wants merger of commodity exchanges Trading briefs ,9/21/08,1.2431
380,2008,9,22,Title,Vietnam approves coffee industry development plan Ethiopia ready to launch coffee trading platform next month Ivorian cocoa strike could impact prices in new season ICE Futures US raises block trading surcharges by two-thirds ,9/22/08,1.2567
381,2008,9,23,Title,Dubai carving itself a position as commodities trading hub Ivory Coast confirms establishment of single cocoa committee Ncdex extends trading times to reflect daylight saving hours ,9/23/08,1.2803
382,2008,9,24,Title,"Peru seeks to expand organic farming Milk product prices, 24 September ",9/24/08,1.2837
383,2008,9,28,Title,Coffee exports slump Coffee exports leap Weather Charts Hurricane damage spurs rise in corn values Vietnam approves new coffee plan to 2015 Concern grows as strike goes on People and places Dubai emerges as commodity trading hub Trading briefs ,9/28/08,1.2837
384,2008,9,29,Title,World coffee production could be hit by lack of finances Economic crisis unlikely to hurt coffee demand says official ,9/29/08,1.2746
385,2008,10,1,Title,"Milk product prices, October 1 India sees rise in coffee exports up to September ",10/1/08,1.2388
386,2008,10,2,Title,Coffee harvest may be shortened in Vietnam to cut costs Central American coffee shipments rise in 2007/08 Japan's coffee supplies rise in August ,10/2/08,1.2251
387,2008,10,3,Title,Guatemalan farmers tempted back to cardamom Coffee values slump to lowest level since last year Industry analyst sees new year coffee market as stable ,10/3/08,1.1966
388,2008,10,5,Title,CenAm coffee year Indian coffee exports people and places Economic turmoil pressures soya downwards Vietnam may trim coffee harvest to cut costs Coffee drinking robust in face of economic woes ICO flags up stretched finances ,10/5/08,1.1966
389,2008,10,6,Title,Uganda increased coffee exports by 19% last year Nestle expects to hit targets in face of weak consumer demand ,10/6/08,1.1658
390,2008,10,7,Title,Trade has few concerns with modified Liffe robusta contract ,10/7/08,1.1103
391,2008,10,8,Title,"FDA issues interim safety results of melamine in food Milk product prices, October 8 Dubai group committed to raising global tea consumption Carcinogenic toxin found in South Korean coffee Mexican coffee exports declined last season Africa still important despite diminishing role in commodity trade ",10/8/08,1.1322
392,2008,10,9,Title,Kenya anticipating boost in coffee production ,10/9/08,1.1024
393,2008,10,10,Title,ICE tweaks softs trading times to reflect global changes Fall in coffee production expected in Colombia Guatemala coffee shipments up in 2007/08 season ,10/10/08,1.1194
394,2008,10,12,Title,Good weather raises coffee production hopes ,10/12/08,1.1194
395,2008,10,26,Title,Vietnam coffee sales ,10/26/08,1.1194
396,2008,10,27,Title,Colombian coffee production dips in September ,10/27/08,1.0373
397,2008,10,28,Title,Philippines aims to stop importing coffee by 2015 ,10/28/08,1.0221
398,2008,10,29,Title,"Indian coffee harvesting may start a month early Milk product prices, October 29 ",10/29/08,1.0432
399,2008,10,30,Title,Nutty bars on sale Exotic blend roll-out Indonesian coffee exporters selling at premium to London Kenya expects $500m biofuels investment in two years ,10/30/08,1.079
400,2008,11,2,Title,Coffee shipments rise Charts Relative calm helps soya rise on bullish report Indonesia seeks first premium for coffee in years Philippines wants to grow more coffee for itself Coffee harvest gets under way early in India Cameroon gets season going with sales rise ,11/2/08,1.079
401,2008,11,3,Title,Sara Lee commits to 30% more sustainable coffee in 2009 Slowing pace of Indian coffee exports gives rise to concern Ivory Coast cocoa strike meeting fails to reach deal ,11/3/08,1.0221
402,2008,11,4,Title,Indonesia bank seizes coffee beans after exporter defaults India predicts strong rise in tea exports this year ,11/4/08,1.0881
403,2008,11,5,Title,"Milk product prices, November 5 Uganda launches big coffee replanting drive ",11/5/08,1.1191
404,2008,11,6,Title,Coffee exports from Guatemala fall in October ,11/6/08,1.1327
405,2008,11,7,Title,Brazil's October coffee shipments increase ,11/7/08,1.0946
406,2008,11,9,Title,Brazil coffee crop Coffee stocks lower Coffee beans seized Canadian dollar strength undermines canola Uganda targets major rise in coffee plantings Indian coffee growth wavers India anticipates substantial rise in tea exports for this year ,11/9/08,1.0946
407,2008,11,10,Title,Kenyan coffee production could exceed estimate this season Indian coffee output may be down on earlier estimates ,11/10/08,1.0847
408,2008,11,11,Title,Financial crisis could hit coffee demand in emerging markets Burundi tea prices decline in October due to ample supplies ,11/11/08,1.1
409,2008,11,12,Title,"Milk product prices, November 12 ",11/12/08,1.0912
410,2008,11,13,Title,Huge potential for Jamaica's pimento oil industry Mexico and El Salvador see decline in October coffee exports Vietnam coffee output will be higher than estimates ,11/13/08,1.0865
411,2008,11,14,Title,Barry Callebaut buys Cameroon cocoa beans for grinding Blanket US ban on Chinese milk composite products ,11/14/08,1.0764
412,2008,11,16,Title,Coffee revenues fall Fund selling amid strong dollar knocks coffee Vietnam boosts coffee exports to record levels Record production potential puts world coffee market on back foot Indian output could be lower than estimated Colombia optimistic over demand Jamaica holds untapped pimento oil potential ,11/16/08,1.0764
413,2008,11,17,Title,Nicaragua expects decline in coffee output this year Brazil coffee crop forecast at 37m bags in 2009/10 season ,11/17/08,1.0772
414,2008,11,18,Title,Nut growers lead call to save research station Kenya sets target for future coffee production growth ,11/18/08,1.0717
415,2008,11,19,Title,"Blanket US ban on milk composite products Milk product prices, November 19 ",11/19/08,1.0688
416,2008,11,20,Title,Research in jeopardy ICE Futures US makes changes to electronic trading times NMCE refreshes two more contracts/eyes arabica launch ,11/20/08,1.0827
417,2008,11,21,Title,USDA forecasts bumper Vietnam coffee crop Indian coffee industry body lowers official crop forecast ,11/21/08,1.0409
418,2008,11,23,Title,Brazilian coffee crop Charts Diversity vital to Olam success Kenya aims to more than double production Massive increase in Sumatran coffee exports People and places Profit-taking makes cocoa gains short-lived ,11/23/08,1.0409
419,2008,11,24,Title,Colombian coffee leader proposes takeover of Starbucks Tanzania earns less for its arabica despite tighter supply Vietnam anticipates major decline in monthly coffee shipments ,11/24/08,1.0376
420,2008,11,25,Title,USDA seeks comment on deregulation of transgenic maize Vietnam coffee prices expected to firm due to forecast floods Heavy rains threaten to damage Panama's gourmet coffee crop ,11/25/08,1.0624
421,2008,11,26,Title,"Milk product prices, November 11 ",11/26/08,1.0677
422,2008,11,27,Title,Honduran coffee output expected to increase ,11/27/08,1.0677
423,2008,11,28,Title,Central government stymies cashew plan Ethiopian coffee auctions end to enable transition to exchange ,11/28/08,1.1068
424,2008,11,30,Title,USDA makes new Vietnam figure Untimely rains trim Indian coffee output by 5% Cameroon's cocoa exports start season well Kenyan coffee rise Better weather pushes corn downwards Charts Honduran coffee rise ,11/30/08,1.1068
425,2008,12,1,Title,EU grant to help Kenya improve its coffee sector Marginal rise in India coffee exports to November ,12/1/08,1.1068
426,2008,12,2,Title,Vietnam coffee growers urged to maintain acreage Drop in Honduran coffee shipments last month ,12/2/08,1.0589
427,2008,12,3,Title,"Milk product prices, December 3 Vietnamese coffee exports likely to decline this year ",12/3/08,1.0515
428,2008,12,4,Title,Indian initiative stymied ,12/4/08,1.042
429,2008,12,5,Title,Ugandan coffee export up by a third last month ,12/5/08,1.0101
